{
  "schema_version": "0.1",
  "scene_id": "a",
  "scene_label": "Test scene A",
  "modules": [
    {
      "id": "container1",
      "path": "/project1/container1",
      "label": "Container1",
      "parameters": [
        {
          "name": "Speed",
          "path": "/project1/container1/Speed",
          "label": "Speed",
          "type": "float",
          "default": 1,
          "semantic": "speed",
          "min": 0,
          "max": 4
        },
        {
          "name": "Period",
          "path": "/project1/container1/Period",
          "label": "Period",
          "type": "float",
          "default": 1,
          "semantic": "period",
          "min": 0.1,
          "max": 4
        },
        {
          "name": "Active",
          "path": "/project1/container1/Active",
          "label": "Active",
          "type": "bool",
          "default": true,
          "semantic": "toggle"
        }
      ]
    },
    {
      "id": "module_a",
      "path": "/project1/module_a",
      "label": "Module A",
      "parameters": [
        {
          "name": "Intensity",
          "path": "/project1/module_a/Intensity",
          "label": "Intensity",
          "type": "float",
          "default": 0.5,
          "semantic": "intensity",
          "min": 0,
          "max": 1
        },
        {
          "name": "Colorhue",
          "path": "/project1/module_a/Colorhue",
          "label": "Color Hue",
          "type": "float",
          "default": 200,
          "semantic": "hue",
          "min": 0,
          "max": 360
        },
        {
          "name": "Scale",
          "path": "/project1/module_a/Scale",
          "label": "Scale",
          "type": "float",
          "default": 1,
          "semantic": "scale",
          "min": 0.1,
          "max": 10
        },
        {
          "name": "Speed",
          "path": "/project1/module_a/Speed",
          "label": "Speed",
          "type": "float",
          "default": 1,
          "semantic": "speed",
          "min": 0,
          "max": 2
        },
        {
          "name": "Active",
          "path": "/project1/module_a/Active",
          "label": "Active",
          "type": "bool",
          "default": true,
          "semantic": "toggle"
        }
      ]
    }
  ]
}
